name,city,dist,address,latitude,longitude
崩崁腳公園,泰山區,大科里,大科路與大科一路口,25.056232,121.402613
黎明步道花園,泰山區,黎明里,泰林路2段542巷進入大窠溪旁,25.0643443,121.422602
未命名,泰山區,義仁里,信華五街旁,25.043777,121.439744
應化大排生態園區,泰山區,明志里,應化街內,25.044694,121.423283
泰山捷運公園,泰山區,義仁里,泰林路與文程路路口,25.050054,121.439648
黎明步道花園,泰山區,黎明里,黎明步道花園旁,25.063658,121.421597
泰山區半山雅路簡易綠美化據點,泰山區,黎明里,泰山區半山雅路,25.067033,121.431524
泰山區中山578-2地號簡易綠美化,泰山區,貴子里及貴和里,泰山區明志路三段204巷,25.038248,121.421861
仁德公園,泰山區,全興里,全興路與仁德路交叉口,25.056681,121.433663
新明里簡易綠美化,泰山區,新明里,新北市泰山區民國街內,25.042872,121.425861
貴子里簡易綠美化,泰山區,貴子里,新北市泰山區明志路三段42巷底,25.042711,121.423835
新北綠家園泰山區同榮段587地號基地,泰山區,義學里,泰山區明志路136巷18弄,25.052091,121.426786
泰山體育園區,泰山區,同榮里,公園路54號,25.055079,121.427966
南林生態公園,泰山區,大科里,新北市泰山區南林路底,25.049563,121.417209
大窠1470,泰山區,大科里,新北市泰山區大科一路301巷口,121.404482,25.055145
公鄰46,林口區,東林里,中正路與泰林路三段路口(東林托兒所下方),25.07705,121.398421
麗林福德公園,林口區,麗林里,公園路與文化一路一段15巷路口,25.069485,121.368768
麗園公園,林口區,麗園里,麗園路與麗園路52巷口,25.069401,121.373409
婦幼公園,林口區,東勢里,文化一路一段與麗園一街9巷之間,25.072364,121.377333
四維公園,林口區,西林里,四維路與佳林路口,25.07517,121.381102
林口社區運動公園(小熊公園),林口區,仁愛里,仁愛路二段、文化一路一段、公園路及仁愛一路之間,25.07426721,121.3757002
自強公園,林口區,東林里,中正路、中山路及粉寮路一段交接處,25.078196,121.397036
扶輪公園,林口區,南勢里,文化二路一段、忠孝路及文化三路一段路口,25.073033,121.368414
湖南公園,林口區,湖南里,民權路165號(湖南市民活動中心)旁,25.084378,121.374312
大崙公園,林口區,南勢里,南勢二街,25.077207,121.359469
井泉公園,林口區,南勢里,南勢二街85巷與南勢四街82巷之間 ,25.069983,121.355903
松柏公園,林口區,中湖里,松柏路,25.091015,121.379321
文林公園,林口區,湖南里,文林二街與文林三街之間,25.08727,121.375596
翰林公園,林口區,湖南里,民權路與文林六街62巷轉角之間,25.081481,121.372406
力行公園,林口區,南勢里,民族路、文化北路一段526巷及文化北路一段542巷路口,25.077828,121.368901
立德公園,林口區,南勢里,民族路與仁愛二路口,25.07647,121.367369
立言公園,林口區,南勢里,忠孝一路與三民路口,25.07317977,121.3625379
立功公園,林口區,南勢里,三民路轉角與文化北路一段60巷轉角之間,25.06776998,121.35835
宗北公園,林口區,中湖里,中北二街轉角與民享路轉角之間,25.088109,121.384567
一品公園,林口區,中湖里,中華一路與民享路口、中北三街,25.083846,121.382824
東湖公園,林口區,西林里,東湖路75巷與東湖路93巷之間,25.07236,121.384761
隆林公園,林口區,西林里,隆林街,25.075361,121.387868
仁愛公園,林口區,林口里,仁愛路一段211巷轉角處、足夢公園旁,25.074507,121.397124
興林公園,林口區,西林里,興林一街,25.072839,121.392076
富貴森林公園,林口區,湖南里,富貴路內,25.08214,121.377574
南勢公園,林口區,南勢里,忠孝一路與南勢二街路口(南勢國小旁),25.073996,121.358824
新寮公園,林口區,林口里,仁愛路一段83巷轉角,25.070217,121.396874
樂活公園,林口區,麗園里、東勢里,忠孝路(崇林國中後),25.066847,121.376205
東明公園,林口區,西林里,興林一街、興林路195巷及興林一街86巷之間,25.072217,121.390502
公鄰43,林口區,東林里,自強五街旁,25.076523,121.398659
樹林口公園,林口區,林口里,中山路與中原街路口附近,25.078374,121.393245
仁愛籃球場,林口區,仁愛里,忠孝路與公園路口,25.071288,121.369962
麗園籃球場,林口區,麗園里,忠孝路與忠孝路542巷口,25.067973,121.372937
東勢籃球場,林口區,東勢里,忠孝路與忠孝路622巷口,25.068206,121.378127
市17跳跳糖兒童遊戲場,林口區,西林里,興林路、興林一街及興林路151巷之間,25.0736732,121.3896417
足夢公園(文小18),林口區,林口里,仁愛路一段與粉寮路一段路口,25.07544419,121.3960709
新林段775-1地號小公園,林口區,西林里,興林路與東湖路口,25.073861,121.389089
東林街綠帶,林口區,東林里,東林街轉角,25.079757,121.394166
興林口公園,林口區,林口里,新北市林口區仁愛路一段378號(新北市林口區公所)旁,25.076833,121.389482
727地號公園,林口區,菁湖里,竹林路與竹林路412巷路口附近,25.08464461,121.3894979
南勢六街新北綠家園,林口區,南勢里,南勢六街轉角處,25.07243047,121.3543181
銅雕公園,林口區,林口里,中山路與中正路口,25.0775,121.397411
櫻花公園,林口區,湖南里,文化二路二段、中華一路及文化三路二段交接(林口國民運動中心旁),25.085452,121.380263
林口段597地號小公園,林口區,菁湖里,竹林路與林口路124巷路口,25.08232545,121.3894709
新林段775-1,林口區,西林里,新北市林口區興林路東湖路交叉口西南側,121.389112,25.073853
吉祥公園,林口區,湖南里,新北市林口區吉祥路,25.08050514,121.3760817
萬福公園,深坑區,萬福里,北深路3段158巷內,25.00441,121.60248
深坑兒童遊戲場,深坑區,深坑里,文化街及平埔街口,25.0016,121.61574
帝品苑旁兒童遊戲場,深坑區,萬順里,北深路三段155巷內,25.00213,121.60144
北深路155巷綠地,深坑區,萬順里,北深路三段155巷內,25.00318,121.60239
埔新274,深坑區,深坑里,新北市深坑區深坑里文化街17巷,25.00092,121.61994
土庫樂活廣場,深坑區,土庫里,新北市深坑區北深路一段83巷8弄36號,25.01005,121.63461
二格公園,石碇區,格頭里,北宜公路 23 公里處,24.956777,121.623978
兒三公園,三芝區,埔坪里,淡金路二段87巷內,25.259653,121.504844
兒一公園,三芝區,埔頭里,公正街上,25.257228,121.499413
兒二公園,三芝區,埔頭里,長勤街上,25.256345,121.50062
櫻花公園,三芝區,埔頭里,埔頭橋邊101線旁,25.251044,121.501457
福成社區公園,三芝區,埔頭里,公所前,25.258,121.500835
福德水車園區,三芝區,福德里,福德生態園區,25.247074,121.507602
芝蘭社區公園,三芝區,後厝里,後厝里淺水灣附近,25.253448,121.472449
智成公園,三芝區,錫板里,智成堂附近,25.257237,121.478647
海灣公園,三芝區,錫板里,錫板里大嘉好加油站附近,25.260139,121.475858
興華驛站,三芝區,興華里,興華國小旁,25.203906,121.502287
根德水車園區,三芝區,古庄里,根德水車園區,25.261194,121.489556
南勢崗公園,三芝區,錫板里,南勢崗往玉堂海釣場入口處,25.26239,121.479346
錫板段海尾小段19地號公園,三芝區,錫板里,台二線錫板公車站旁,25.258191,121.476695
自行車公園,三芝區,新庄里,三和市民活動中心旁,25.268775,121.50135
乾華濱海廣場,石門區,乾華里,新北市石門區阿里磅1-1號旁,25.293181,121.585005
石門洞遊憩區,石門區,尖鹿里,新北市石門區尖鹿里中央路37之2號(五龍宮)斜對面,25.295213,121.567952
新幸福公園,石門區,尖鹿里,新北市石門區中山路62之7號對面,121.5666739,25.290553
福安公園,石門區,尖鹿里,新北市石門區尖鹿里中山路70之5號前,25.291614,121.568152
魔法廣場,石門區,茂林里,新北市石門區茂林里坪林20號前,25.269029,121.593075
幸福雙心公園,石門區,富基里,台2線與老梅路、淡金公路交會處,25.28902305,121.5415353
北河公園,八里區,大崁里,新北市八里區忠孝路與忠八街路口,25.16096831,121.4202928
南山公園,八里區,大崁里,新北市八里區賢三街30號對面,25.15857256,121.4186447
文昌公園,八里區,埤頭里,新北市八里區中山路一段與文昌路口,25.1568586,121.410733
狀元公園,八里區,舊城里,新北市八里區文昌五街與狀元路口,25.15438655,121.4103385
片仔溝公園,八里區,舊城里,新北市八里區中華路二段258巷與中華路口,25.15021716,121.4057624
舊城公園,八里區,舊城里,新北市八里區中山路二段303巷底,25.14766811,121.4014849
商港一路綠地,八里區,訊塘里,新北市八里區中山路二段500巷與商港一路交叉街口,25.14767199,121.3969198
訊塘社區公園,八里區,訊塘里,新北市八里區商港路與中山路二段路口,25.14563487,121.3962236
十三行文化公園,八里區,埤頭里,博物館路(清潔隊旁),25.165252,121.413239
陽光廣場,八里區,頂罟里,八里區博物館路,25.157094,121.404155
水仙公園,八里區,訊塘里,新北市八里區商港路與商港三路口,25.14291453,121.3914704
商港公園,八里區,訊塘里,新北市八里區商港八路與商港一路口,25.15025761,121.3990851
訊庄埔公園,八里區,訊塘里,新北市八里區中山路三段及訊塘一路,25.14218497,121.3921133
公博一公園,八里區,頂罟里,八里大道與商港三路(公博一公園),25.15808295,121.4041783
八里區行政大樓,八里區,頂罟里,新北市八里區八里大道與中山路二段,25.15392496,121.4064933
頂罟活動中心綠地,八里區,舊城里,新北市八里區八里大道與中山路二段,25.15313161,121.4074393
大崁環保公園,八里區,大崁里,新北市八里區觀海大道29號對面,25.16015552,121.4298024
龍源公園,八里區,龍源里,新北市八里區龍形一街與龍形二街交叉處,25.13076958,121.4505452
訊塘廣場,八里區,訊塘里,新北市八里區訊塘一路與訊塘二路(廖添丁廟旁) ,25.14303389,121.3960018
商港三路綠帶,八里區,訊塘里,新北市八里區商港三路旁,25.1539997,121.4021531
商港五路綠帶,八里區,訊塘里,新北市八里區商港五路旁,25.15481687,121.399843
忠孝綠地,八里區,埤頭里,新北市八里區忠孝路302號對面,25.1613413,121.4187876
頂罟二路綠地,八里區,頂罟里,新北市八里區頂罟二路旁,25.15189939,121.40273
商港一路廣場,八里區,頂罟里,新北市八里區商港一路(中廣綠家園後),25.15286183,121.4038072
八里大道廣場,八里區,頂罟里,新北市八里區八里大道與中山路二段交叉處,25.15370112,121.4062611
環教中心左岸會館,八里區,大崁里,八里環教中心,25.16064748,121.4303789
下罟子漁港綠帶,八里區,下罟里,下罟子漁港旁,25.142398,121.381452
八里龍米公園,八里區,龍源里,龍米路及米倉公園,25.149167,121.405
新北考古公園,八里區,頂罟里,商港三路2號,121.403831,25.15657
米倉公園,八里區,米倉區,河川區域無住址,25.154611,121.440194
十三行文化公園-兒童遊戲場,八里區,頂罟里,新北市八里區博物館路及忠孝街口,25.16422486,121.412323
八里左岸公園,八里區,大崁里,河川區域無住址,25.160833,121.43
龍米河濱公園,八里區,null,河川區域,25.149792,121.443854
頂罟公園(中廣綠家園),八里區,頂罟里,新北市八里區中山路二段129巷對面,25.152277,121.40481
渡船頭公園,八里區,米倉里,新北市八里區龍米路二段201巷,25.157481,121.433849
八里婚紗廣場,八里區,null,249新北市八里區,25.16211461,121.427971
水興公公園(綠林城堡冒險趣遊戲場),八里區,大崁里,新北市八里區觀海大道100號（河濱公園內）,25.162397,121.4255376
十分瀑布公園,平溪區,南山里,新北市平溪區南山里乾坑10號,25.047868,121.78272
十分公園,平溪區,十分里,新北市平溪區十分街66巷1號,25.04219279,121.7756802
雙溪兒童公園,雙溪區,共和里,新北市雙溪區東榮街(雙溪國小對面),25.03277,121.867093
雙溪公園,雙溪區,雙溪里,新北市雙溪區雙溪里,337222.3162,2770098.923
三貂運動公園,雙溪區,三貂里,三貂里牡丹派出所旁，尪子崙坑路,335628,2772486
龍門公園,貢寮區,龍門里,新北市貢寮區龍門里鄰台2線旁,25.0039454,121.9583462
澳底公園,貢寮區,仁里里,新北市貢寮區仁愛路43號,25.054018,121.925433
環保公園,貢寮區,貢寮里,新北市貢寮區長泰路20號,25.02025714,121.9075296
中山溫泉公園,金山區,大同里,新北市金山區溫泉路2巷9號,25.221745,121.640422
豐漁里公園,金山區,豐漁里,新北市金山區豐漁里民生路172-1號,25.223068,121.6469856
運動休閒廣場,金山區,五湖里,新北市金山區五湖里南勢53號1F,25.221304,121.629054
公館崙公園,金山區,五湖里,新北市金山區龜子山路,25.213635,121.634144
犀牛綠地 ,金山區,五湖里,新北市金山區五湖里陽金公路旁,25.219215,121.620699
豐漁里綠地,金山區,豐漁里,新北市金山區豐漁里民生路巷號208對面,25.222414,121.647566
磺港綠地 ,金山區,磺港里,新北市金山區磺港里磺港路,25.22767,121.645102
虎豹獅象綠地,金山區,豐漁里,新北市金山區民生路(中山公園停車場斜對面),25.221025,121.642493
迴旋穿透綠地,金山區,大同里,新北市金山區民生路及公園路交叉口,25.221316,121.642816
飛撲綠地,金山區,清泉里,中山路與環金路口,25.21761,121.641668
流蘇公園,金山區,美田里,新北市金山區三民街與八德街交叉處,25.223078,121.634538
櫻花公園,金山區,大同里,新北市金山區和平里民生路67號後方,25.22007,121.640535
杜鵑公園,金山區,金美里,新北市金山區信義路,25.220101,121.636428
櫻花綠地,金山區,和平里,新北市金山區中山路８８號左後方公園,25.218593,121.641545
萬里觀光公園,萬里區,中幅里,中萬里加投段中幅子小段,25.173917,121.683306
獅子公園,萬里區,萬里里, 207台灣新北市萬里區北部濱海公路,25.174667,121.706056
野柳休閒公園,萬里區,野柳里,新北市萬里區野柳里港東路,25.204611,121.688222
瑪鋉公園,萬里區,萬里里,瑪鍊路60-1號對面 ,25.175583,121.690028
翡翠灣涼亭,萬里區,龜吼里,新北市207萬里區龜吼里,25.185182,121.685032
圓潭溪步道,萬里區,磺潭里,新北市207萬里區磺潭里,25.200581,121.646113
員潭溪廣場,萬里區,大鵬里,大鵬段13-2號,25.2216,121.64772
加投路涼亭,萬里區,大鵬里,大鵬里 207新北市萬里區,25.217744,121.645638
下社大鵬里下寮涼亭,萬里區,大鵬里,大鵬里 207新北市萬里區,25.215175,121.647866
螃蟹主題公園,萬里區,龜吼里,新北市萬里區龜吼里,25.205389,121.683583
瑪鋉運動公園,萬里區,萬里里,新北市萬里區獅頭路,25.17523,121.69022
萬里幸福廣場,萬里區,萬里里,207新北市萬里區獅頭路15-8號(周邊),25.180092,121.698894
烏來原住民主題公園,烏來區,烏來里,新北市烏來區西羅岸段 911地號,24.849375,121.549776
七虎公園,台北市,長安里,育仁路108號（薇閣小學旁）,25.13649941,121.5020599
七星公園,台北市,長安,光明路、中山路交叉口（新北投捷運站）,25.13661957,121.5030212
八仙公園,台北市,八仙,公館路423巷8弄,25.120286,121.502916
大豐公園,台北市,清江里,公館路13號旁,25.13194084,121.5037308
中央簡易公園,台北市,中央里,大興街與中央南路二段6巷口,25.12809944,121.4999237
中庸1號公園,台北市,中庸里,位於北投區中庸里雙全街50號對面,25.13804054,121.5012436
丹鳳公園,台北市,奇岩里,公館路255巷19弄旁,25.1264801,121.5109787
公館公園,台北市,奇岩里,奇岩新社區(公三),25.12799072,121.5064316
天狗庵遺址,台北市,溫泉,溫泉路73巷(天狗庵舊址),25.13592911,121.5066681
文化一號公園(施工中111/5~111/12),台北市,文化里,位於北投區文化里中央北路二段文化國小對面,25.136535,121.496462
文化二號公園(施工中111/5~111/12),台北市,文化里,位於北投區文化里中央北路一段228巷,25.13643074,121.4968414
文化三號公園,台北市,文化里,中央北路二段68巷進入(42巷11弄旁),25.13769913,121.4947128
北投258號綠地(承德4號),台北市,建民里,承德路六段與福國路交叉口，北投士林科技園區(綠4，區段徵收),25.1019,121.51245
北投二號公園,台北市,林泉里,中山路2號,25.13705,121.508221
北投公園,台北市,"長安里,林泉里,溫泉里",北投區中山路、光明路所圍範圍,25.13656044,121.5047302
北投社三層崎公園,台北市,秀山里,北投區秀山路50號旁,25.14574,121.491156
石牌公園,台北市,"尊賢里,吉利里",石牌路一段39巷內,25.11635971,121.5103607
立農公園,台北市,立農里,承德路七段378號,25.11878967,121.5035095
吉利公園,台北市,立農里,位於北投區立農里吉利街179號旁,25.11901093,121.5083695
同德公園,台北市,永欣里,位於北投區永欣里同德街27巷19號對面,25.12507057,121.5294495
地熱谷公園,台北市,林泉里,臺北市北投區中山路30-1號(中山路與溫泉路交口),25.13755989,121.5109787
行義公園,台北市,"永和里,永欣里",石牌路二段343巷8號,25.1253891,121.5252304
奇岩一號公園,台北市,奇岩里,臺北市北投區磺港路208號(奇岩新社區公一),25.128339,121.503698
奇岩二號公園,台北市,奇岩里,臺北市北投區216號(奇岩新社區公二),25.12649918,121.5036926
奇岩三號公園,台北市,奇岩里,奇岩新社區(公四),25.12598038,121.5052185
東華公園,台北市,東華里,東華街二段300巷19號對面,25.12183952,121.5070725
林泉公園,台北市,林泉,溫泉路168號旁,25.14133,121.51482
知行公園,台北市,關渡里,位於北投區關渡里知行路225巷,25.11973,121.4666519
長安公園,台北市,長安里,育仁路109號對面(薇閣國小旁),25.13555908,121.5001602
前山公園,台北市,湖山里,臺北市北投區建國街4號旁及紗帽路117號對面,25.15057652,121.5484437
建民公園,台北市,建民里,文林北路16巷7號對面,25.104744,121.519809
泉源47號公園,台北市,泉源里,泉源路80號對面山腳下,25.14209938,121.5124588
泉源48號公園,台北市,泉源里,北投珠海路120號附近,25.14193916,121.5071564
洲美(公4)公園,台北市,洲美里,洲美街122號,25.100089,121.506347
洲美蜆仔港公園,台北市,建民里,台北市士林區承德路六段329號,25.10099711,121.5111864
致遠公園,台北市,榮光里,位於北投區榮光里致遠一路二段自強市場旁,25.11127091,121.5150528
重三公園,台北市,稻香里,新興路與重三路交叉口(重三新村八期重劃)政校後勤區,25.14015961,121.4892883
振華公園,台北市,振華里,位於北投區振華里振華街24號對面,25.11516953,121.5188522
振興公園,台北市,榮華里,天母西路與磺溪交叉口,25.11821938,121.5230408
桂花公園,台北市,林泉,中山路5-7號(林泉里辦公處旁),25.13791084,121.5102234
桃源公園,台北市,桃源里,中央北路三段148巷底,25.13806915,121.4827576
健行公園,台北市,東華里,位於北投區東華里致遠三路147巷二弄內,25.1212101,121.5088272
崇仰公園,台北市,奇岩里,崇仰一路、公館路225巷底,25.12609,121.51106
清江一公園,台北市,清江里,位於北投區清江里崇仁路一段154號對面,25.1239109,121.5024796
清江二公園,台北市,清江里,位於北投區清江里崇仁路1段154號旁,25.12368012,121.5018921
軟橋公園,台北市,建民里,台北市北投區文林北路53巷51號,25.103102,121.517613
復興公園,台北市,中心里,北投中和街200號,25.1396904,121.5032272
開明公園,台北市,"中心里,開明",珠海路112號附近,25.14113045,121.5053177
陽明公園,台北市,湖山里,臺北市北投區湖山路二段,25.15901675,121.5390112
新興公園,台北市,稻香里,新興路145號旁(六期重劃),25.13934,121.48703
溫泉綠地,台北市,林泉,溫泉路137號旁,25.138933,121.512342
聖景一公園,台北市,關渡里,聖景路100號內,25.12045,121.46351
聖景二公園,台北市,關渡里,聖景路101號旁,25.12038,121.46381
聖景三公園,台北市,關渡里,聖景路100號內,25.12046,121.46382
榮光公園,台北市,榮光里,位於北投區榮光里石牌路1段石牌國中對面,25.11472,121.51429
榮富公園,台北市,榮華里,榮華三路及磺溪旁(過天母橋),25.1142292,121.5247269
榮華公園,台北市,榮華里,明德路150巷3弄,25.11054993,121.5219879
福星(公1)公園,台北市,福興里,文林北路255號,25.108828,121.512326
稻中公園,台北市,稻香里,中央北路二段334號旁(政校後勤區),25.13862991,121.4892807
稻香公園,台北市,稻香里,位於北投區稻香里新興路72號對面,25.14094925,121.4885788
線形公園-芝山明德段,台北市,裕民里,北投區線形公園東華街一段,25.1123725,121.51714
學園公園,台北市,一德里,學園路、藝術大學門口旁,25.1282692,121.4663467
磺港公園,台北市,清江里,磺港路大興街交口,25.130512,121.50446
豐年公園,台北市,豐年里,位於北投區豐年里中央北路大業路口,25.13600922,121.4966583
關渡公園,台北市,關渡里,知行路210巷底,25.11973,121.46369
觀海公園,台北市,關渡里,中央北路4段601巷附近,25.12358093,121.4634476
嗄嘮別公園,台北市,桃源里,中央北路三段、桃源國小東北側,25.14035034,121.4844208
大業綠地(北投163號),台北市,"中央里,大同里,八仙里,豐年里",大業路西側大度路口起延伸至大業路517巷旁田埂路,25.13624001,121.4905396
中和綠地,台北市,中和里,中和街363號附近,25.14188004,121.4988022
天溪綠地,台北市,永和,行義路58巷33號附近,25.13519,121.5301
文化綠地,台北市,文化里,大業路、永興路一段交叉口,25.137449,121.498406
北投106號綠地,台北市,裕民里,建明路165之1及明德路旁(石牌綠地系統),25.11108208,121.5209045
北投120號綠地,台北市,"立農里,八仙里",承德路七段400號前(公館路至磺港溪間),25.120132,121.501115
北投121號綠地,台北市,立賢里,承德路七段214號前東側,25.11664009,121.5049896
北投122號綠地,台北市,吉慶里,承德路七段168號旁前東側,25.11306953,121.5089264
北投123號綠地,台北市,"立農里,八仙里",承德路七段前西側(尊賢街267巷口對面起迄立農公園對面),25.117135,121.503849
北投124號綠地,台北市,"建民里,吉慶里,福興里,立賢里",承德路六段到承德路七段(福國路口起迄立賢西路口間)前西側,25.114865,121.506329
北投135號綠地,台北市,福興里,承德路七段上(32巷至石牌路一段間),25.11183929,121.5103073
北投138號綠地,台北市,立賢里,承德路七段右側，立賢路南側,25.11441994,121.502739
北投139號綠地,台北市,立賢里,承德路七段右側，立賢路北側,25.11502075,121.5031281
北投160號綠地,台北市,豐年里,大業路二段533-545號前,25.135316,121.496586
北投161號綠地 (田心仔綠地),台北市,豐年里,中央北路二段257巷東側，大業路525巷6弄旁,25.13513947,121.4949265
北投164號綠地,台北市,大同里,大業路東側，十信工高旁,25.13344955,121.4959793
北投165號綠地,台北市,大同里,大業路452巷,25.13175964,121.4962387
北投166號綠地,台北市,大同里,大業路東側,25.13051033,121.496872
北投167號綠地,台北市,中央里,大業路400號東側,25.128405,121.497707
北投168號綠地,台北市,八仙里,大業路50號東側,25.12437058,121.4991913
北投169號綠地,台北市,八仙里,大度路一段，承德路口南側,25.12072,121.499533
北投181號一德綠地,台北市,一德里,大度路三段，中央北路四段(萬善宮旁),25.12393951,121.4647675
北投182號綠地,台北市,一德里,大度路三段274號北側,25.12339973,121.4677277
北投183號綠地,台北市,一德里,大度路三段北側,25.12301064,121.4718628
北投185號綠地,台北市,關渡里,大度路三段南側(關渡派出所後),25.123425,121.464987
北投186號綠地,台北市,關渡里,大度路三段南側，知行路314號旁,25.12302971,121.4665299
北投187號綠地,台北市,關渡里,大度路三段南側,25.12290955,121.4682922
北投188號綠地,台北市,關渡里,大度路三段南側,25.12274933,121.4705582
北投191號綠地,台北市,"八仙里,一德里",大度路二段北側,25.12248993,121.4808426
北投192號綠地,台北市,八仙里,大度路二段南側,25.12208939,121.4809113
北投203號綠地,台北市,八仙里,公館路423巷11-17號前(區段徵收),25.12065,121.5031
北投257號綠地(承德3號),台北市,建民里,承德路六段上，北投士林科技園區(綠3，區段徵收),25.10442,121.512199
北投39號綠地,台北市,關渡里,聖景路140~150號前,25.121984,121.462777
北投62號綠地,台北市,"清江里,奇岩里",磺港路上(清江路177巷口至清江路113巷口),25.129382,121.503215
北投63號綠地,台北市,"清江里,奇岩里",磺港路上(三合橋旁至清江路177巷口),25.12759018,121.5033417
北投64號綠地,台北市,"清江里,奇岩里",磺港路上(崇仁路一段131巷口至三合橋旁),25.126383,121.503285
北投65號綠地,台北市,"清江里,奇岩里",磺港路上(崇仁路一段155巷口至131巷口),25.1246891,121.5030518
北投66號綠地,台北市,八仙里,磺港路上(崇仁路一段155巷口兩側),25.12373924,121.5029602
北投69號綠地,台北市,奇岩里,崇仰一路11號旁,25.12602043,121.5120392
北投90號綠地,台北市,振華里,石牌路二段臺北護理大學圍牆外(榮總對面),25.11861992,121.5203323
